id,gender,masterCategory,subCategory,articleType,baseColour,season,year,usage,productDisplayName
12538,Men,Apparel,Bottomwear,Track Pants,Blue,Fall,2011,Casual,Puma Men Solid Blue Track Pants
12539,Women,Apparel,Topwear,Tshirts,Black,Fall,2011,Casual,Tantra Women Black Printed T-shirt
12540,Women,Apparel,Topwear,Tshirts,Blue,Fall,2011,Casual,Tantra Women Blue Printed T-shirt
12541,Women,Apparel,Topwear,Tshirts,White,Fall,2011,Casual,Tantra Women White Printed T-shirt
12542,Women,Apparel,Topwear,Tshirts,Blue,Fall,2011,Casual,Tantra Women Blue Printed T-shirt
12543,Women,Apparel,Topwear,Tshirts,Pink,Fall,2011,Casual,Tantra Women Printed Pink T-shirt
12544,Women,Apparel,Topwear,Tshirts,Peach,Fall,2011,Casual,Tantra Women Printed Peach T-shirt
12545,Women,Apparel,Topwear,Tshirts,White,Fall,2011,Casual,Tantra Women White Printed T-shirt
12546,Women,Apparel,Topwear,Tshirts,Blue,Fall,2011,Casual,Tantra Women Blue Printed T-shirt
12556,Men,Apparel,Topwear,Tshirts,Green,Fall,2011,Casual,Tantra Men Green Printed T-shirt
12557,Men,Apparel,Topwear,Tshirts,Red,Fall,2011,Casual,Tantra Men Red Printed T-shirt
12560,Men,Apparel,Topwear,Tshirts,Blue,Fall,2011,Casual,Tantra Men Printed Blue Tshirts
12567,Men,Apparel,Topwear,Tshirts,Black,Fall,2011,Casual,Tantra Men Black Printed T-shirt
12568,Men,Apparel,Topwear,Tshirts,Brown,Fall,2011,Casual,Tantra Men Printed Brown T-shirt
12569,Men,Apparel,Topwear,Tshirts,White,Fall,2011,Casual,Tantra Men Printed White Tshirts
12572,Men,Apparel,Topwear,Tshirts,Navy Blue,Fall,2011,Casual,Tantra Men Navy Blue Printed T-shirt
12576,Women,Apparel,Topwear,Tshirts,Black,Fall,2011,Casual,Tantra Women Black Printed T-shirt
12577,Women,Apparel,Topwear,Tshirts,Black,Fall,2011,Casual,Tantra Women Black Printed T-shirt
12578,Women,Apparel,Topwear,Tshirts,Purple,Fall,2011,Casual,Tantra Women Purple Printed T-shirt
12579,Women,Apparel,Topwear,Tshirts,Orange,Fall,2011,Casual,Tantra Women Orange Printed T-shirt
12580,Women,Apparel,Topwear,Tshirts,Blue,Fall,2011,Casual,Tantra Women Blue Printed T-shirt
12581,Women,Apparel,Topwear,Tshirts,Blue,Fall,2011,Casual,Tantra Women Blue T-shirt
12582,Unisex,Apparel,Topwear,Tshirts,White,Fall,2011,Casual,Tantra Unisex Printed White Tshirts
12583,Unisex,Apparel,Topwear,Tshirts,Green,Fall,2011,Casual,Tantra Unisex Printed Green Tshirts
12584,Unisex,Apparel,Topwear,Tshirts,Green,Fall,2011,Casual,Tantra Unisex Printed Green Tshirts
12585,Unisex,Apparel,Topwear,Tshirts,Blue,Fall,2011,Casual,Tantra Unisex Printed Blue Tshirts
12586,Unisex,Apparel,Topwear,Tshirts,Pink,Fall,2011,Casual,Tantra Unisex Printed Pink Tshirts
12587,Unisex,Apparel,Topwear,Tshirts,Brown,Fall,2011,Casual,Tantra Unisex Printed Brown Tshirts
12588,Unisex,Apparel,Topwear,Tshirts,Blue,Fall,2011,Casual,Tantra Unisex Printed Blue Tshirts
12589,Unisex,Apparel,Topwear,Tshirts,Brown,Fall,2011,Casual,Tantra Unisex Printed Brown Tshirts
12590,Unisex,Apparel,Topwear,Tshirts,White,Fall,2011,Casual,Tantra Unisex Printed White Tshirts
12591,Unisex,Apparel,Topwear,Tshirts,Blue,Fall,2011,Casual,Tantra Unisex Printed Blue Tshirts
12592,Unisex,Apparel,Topwear,Tshirts,Green,Fall,2011,Casual,Tantra Unisex Printed Green Tshirts
12593,Unisex,Apparel,Topwear,Tshirts,Blue,Fall,2011,Casual,Tantra Unisex Printed Blue Tshirts
12594,Unisex,Apparel,Topwear,Tshirts,Blue,Fall,2011,Casual,Tantra Unisex Printed Blue Tshirts
12595,Unisex,Apparel,Topwear,Tshirts,Black,Fall,2011,Casual,Tantra Unisex Printed Black Tshirts
12597,Unisex,Apparel,Topwear,Tshirts,White,Fall,2011,Casual,Tantra Unisex Printed White Tshirts
12598,Unisex,Apparel,Topwear,Tshirts,Orange,Fall,2011,Casual,Tantra Unisex Printed Orange Tshirts
12599,Unisex,Apparel,Topwear,Tshirts,Green,Fall,2011,Casual,Tantra Unisex Printed Green Tshirts
12600,Unisex,Apparel,Topwear,Tshirts,Black,Fall,2011,Casual,Tantra Unisex Printed Black Tshirts
12601,Unisex,Apparel,Topwear,Tshirts,Red,Fall,2011,Casual,Tantra Unisex Printed Red Tshirts
12602,Unisex,Apparel,Topwear,Tshirts,Green,Fall,2011,Casual,Tantra Unisex Printed Green Tshirts
12603,Unisex,Apparel,Topwear,Tshirts,Red,Fall,2011,Casual,Tantra Unisex Printed Red Tshirts
12604,Women,Apparel,Topwear,Tops,Purple,Fall,2011,Casual,Jealous 21 Women Printed Purple Tops
12605,Women,Apparel,Topwear,Tops,Black,Fall,2011,Casual,Jealous 21 Women Stripes Black Tops
12606,Women,Apparel,Topwear,Tops,Cream,Fall,2011,Casual,Jealous 21 Women Printed Cream Tops
12607,Women,Apparel,Topwear,Tops,Purple,Fall,2011,Casual,Jealous 21 Women Solid Purple Shrug
12608,Women,Apparel,Topwear,Tops,Maroon,Fall,2011,Casual,Jealous 21 Women Printed Maroon Tops
12609,Women,Apparel,Topwear,Sweaters,Blue,Fall,2011,Casual,Jealous 21 Women Solid Blue Sweaters
12610,Women,Apparel,Topwear,Tops,Purple,Fall,2011,Casual,Jealous 21 Women Printed Purple Tops
12611,Women,Apparel,Topwear,Tops,Green,Fall,2011,Casual,Jealous 21 Women Printed Green Tops
12612,Men,Apparel,Topwear,Tshirts,Orange,Fall,2011,Casual,Ed Hardy Men Printed Orange Tshirts
12613,Men,Apparel,Topwear,Tshirts,Black,Fall,2011,Casual,Ed Hardy Men Printed Black Tshirts
12614,Men,Apparel,Topwear,Tshirts,White,Fall,2011,Casual,Ed Hardy Men Printed White Tshirts
12615,Men,Apparel,Topwear,Tshirts,Red,Fall,2011,Casual,Ed Hardy Men Printed Maroon Tshirts
12616,Men,Apparel,Topwear,Tshirts,Peach,Fall,2011,Casual,Ed Hardy Men Printed Peach Tshirts
12617,Men,Footwear,Shoes,Casual Shoes,Brown,Winter,2018,Casual,Red Tape Men Casual Brown Casual Shoes
12618,Men,Apparel,Topwear,Tshirts,Blue,Fall,2011,Casual,Probase Men Stripes Blue Polo T-Shirts
12619,Men,Apparel,Topwear,Tshirts,Grey,Fall,2011,Casual,Probase Men Printed Grey Tshirts
12620,Men,Apparel,Topwear,Tshirts,Red,Fall,2011,Casual,Probase Men Printed Red Tshirts
12621,Men,Apparel,Topwear,Tshirts,Grey,Fall,2011,Casual,Probase Men Printed Grey Tshirts
12622,Men,Apparel,Topwear,Tshirts,Blue,Fall,2011,Casual,Probase Men Printed Blue Tshirts
12623,Men,Apparel,Topwear,Tshirts,Green,Fall,2011,Casual,Probase Men Printed Green Tshirts
12624,Men,Apparel,Topwear,Tshirts,Green,Fall,2011,Casual,Probase Men Printed Green Tshirts
12625,Men,Apparel,Topwear,Tshirts,Orange,Fall,2011,Casual,Probase Men Printed Orange Tshirts
12626,Men,Apparel,Topwear,Tshirts,Navy Blue,Fall,2011,Casual,Probase Men Printed Navy Blue Tshirts
12627,Men,Apparel,Topwear,Tshirts,Black,Fall,2011,Casual,Probase Men Printed Black Tshirts
12629,Men,Apparel,Topwear,Tshirts,Red,Fall,2011,Casual,Probase Men Printed Red Tshirts
12630,Men,Apparel,Topwear,Tshirts,Blue,Fall,2011,Casual,Probase Men Printed Blue Tshirts
12631,Men,Apparel,Topwear,Tshirts,Red,Fall,2011,Casual,Probase Men Printed Red Tshirts
12632,Men,Apparel,Topwear,Tshirts,Grey,Fall,2011,Casual,Probase Men Printed Grey Tshirts
12633,Men,Apparel,Topwear,Tshirts,White,Fall,2011,Casual,Probase Men Printed White Tshirts
12634,Men,Apparel,Topwear,Tshirts,Maroon,Fall,2011,Casual,Probase Men Printed Maroon Tshirts
12635,Men,Apparel,Topwear,Tshirts,Yellow,Fall,2011,Casual,Probase Men Printed Yellow Tshirts
12636,Men,Apparel,Topwear,Tshirts,Blue,Fall,2011,Casual,Probase Men Printed Blue Tshirts
12637,Men,Apparel,Topwear,Tshirts,Black,Fall,2011,Casual,Probase Men Printed Black Tshirts
12638,Men,Apparel,Topwear,Tshirts,Maroon,Fall,2011,Casual,Probase Men Solid Maroon Tshirts
12639,Men,Apparel,Topwear,Tshirts,White,Fall,2011,Casual,Probase Men Printed White Tshirts
12640,Men,Apparel,Topwear,Tshirts,Grey,Fall,2011,Casual,Probase Men Solid Grey Tshirts
12641,Men,Apparel,Topwear,Tshirts,White,Fall,2011,Casual,Probase Men Printed White Tshirts
12642,Men,Apparel,Topwear,Tshirts,Maroon,Fall,2011,Casual,Probase Men Stripes Maroon Polo T-shirts
12643,Men,Apparel,Topwear,Tshirts,Black,Fall,2011,Casual,Probase Men Solid Black  Polo T-shirts
12644,Men,Apparel,Topwear,Tshirts,White,Fall,2011,Casual,Probase Men Solid White Polo T-shirts
12645,Men,Apparel,Topwear,Tshirts,Pink,Fall,2011,Casual,Probase Men Stripes Pink Polo T-shirts
12646,Men,Apparel,Topwear,Tshirts,Blue,Fall,2011,Casual,Probase Men Stripes Blue Tshirts
12649,Men,Apparel,Topwear,Tshirts,White,Fall,2011,Casual,Probase Men Printed White Tshirts
12650,Men,Apparel,Topwear,Tshirts,Maroon,Fall,2011,Casual,Probase Men Printed Maroon Tshirts
12651,Men,Apparel,Topwear,Tshirts,Blue,Fall,2011,Casual,Probase Men Printed Blue Tshirts
12652,Men,Apparel,Topwear,Tshirts,Blue,Fall,2011,Casual,Probase Men Printed Blue Tshirts
12653,Men,Apparel,Topwear,Tshirts,Grey,Fall,2011,Casual,Probase Men Printed Grey Tshirts
12654,Men,Apparel,Topwear,Tshirts,Purple,Fall,2011,Casual,Probase Men Printed Royal Blue Tshirts
12655,Men,Apparel,Topwear,Tshirts,Purple,Fall,2011,Casual,Probase Men Printed Purple Tshirts
12656,Men,Apparel,Topwear,Shirts,White,Fall,2011,Casual,Probase Men Stripes White Shirts
12657,Men,Apparel,Topwear,Shirts,White,Fall,2011,Casual,Probase Men Stripes White Shirts
12658,Men,Apparel,Topwear,Shirts,White,Fall,2011,Casual,Probase Men Stripes White Shirts
12659,Men,Apparel,Topwear,Shirts,White,Fall,2011,Casual,Probase Men Stripes White Shirts
12660,Men,Apparel,Topwear,Shirts,Pink,Fall,2011,Casual,Probase Men Stripes Pink Shirts
12661,Men,Apparel,Topwear,Shirts,Blue,Fall,2011,Casual,Probase Men Stripes Blue Shirts
12662,Men,Apparel,Topwear,Shirts,White,Fall,2011,Casual,Probase Men Stripes White Shirts
12663,Men,Apparel,Topwear,Shirts,Blue,Fall,2011,Casual,Probase Men Stripes Blue Shirts
12664,Men,Apparel,Topwear,Shirts,Grey,Fall,2011,Casual,Probase Men Stripes Grey Shirts
12665,Men,Apparel,Topwear,Shirts,Blue,Fall,2011,Casual,Probase Men Check Blue Shirts
12666,Men,Apparel,Topwear,Shirts,Grey,Fall,2011,Casual,Probase Men Check Grey Shirts
12667,Men,Apparel,Topwear,Shirts,Blue,Fall,2011,Casual,Probase Men Check Blue Shirts
12668,Men,Apparel,Topwear,Shirts,White,Fall,2011,Casual,Probase Men Printed White Shirts
12669,Men,Apparel,Topwear,Shirts,White,Fall,2011,Casual,Probase Men Stripes White Shirts
12670,Men,Apparel,Bottomwear,Shorts,White,Fall,2011,Casual,Probase Men Check White Shorts
12671,Men,Apparel,Bottomwear,Shorts,Red,Fall,2011,Casual,Probase Men Check Red Shorts
12672,Men,Apparel,Bottomwear,Shorts,Yellow,Fall,2011,Casual,Probase Men Yellow Shorts
12673,Men,Apparel,Bottomwear,Trousers,Beige,Fall,2011,Casual,Probase Men Solid Beige Cargos
12674,Men,Apparel,Bottomwear,Trousers,Olive,Fall,2011,Casual,Probase Men Solid Olive Cargos
12675,Men,Apparel,Bottomwear,Trousers,Green,Fall,2011,Casual,Probase Men Printed Green Trousers
12676,Men,Apparel,Bottomwear,Trousers,Brown,Fall,2011,Casual,Probase Men Solid Brown Trousers
12677,Men,Apparel,Bottomwear,Trousers,Grey,Fall,2011,Casual,Probase Men Check Grey Trousers
12678,Men,Apparel,Bottomwear,Trousers,Black,Fall,2011,Casual,Probase Men Check Black Trousers
12679,Men,Apparel,Bottomwear,Trousers,Black,Fall,2011,Casual,Probase Men Solid Black Trousers
12680,Unisex,Accessories,Headwear,Caps,Navy Blue,Summer,2011,Casual,Probase Unisex Solid Navy Blue Caps
12681,Men,Accessories,Headwear,Caps,Blue,Summer,2011,Casual,Probase Men Check Blue Cap
12683,Women,Footwear,Shoes,Sports Shoes,White,Fall,2011,Sports,Fila Women Elixir Low White Shoes
12685,Men,Footwear,Shoes,Casual Shoes,Black,Fall,2011,Casual,Fila Men Vintage Hi Black Casual Shoes
12688,Unisex,Footwear,Sandal,Sandals,Black,Fall,2011,Casual,Fila Unisex Opera Black Slippers
12691,Men,Footwear,Shoes,Sports Shoes,Grey,Fall,2011,Sports,Nike Men Dual Fusion Grey Sports Shoes
12692,Men,Footwear,Shoes,Sports Shoes,Black,Summer,2012,Sports,Nike Men Transform Black Sports Shoes
12693,Women,Footwear,Shoes,Sports Shoes,White,Summer,2012,Sports,Nike Women Transform White Sports Shoes
12694,Men,Footwear,Shoes,Sports Shoes,White,Fall,2011,Sports,Nike Men Atlntc Bl White Sports Shoes
12695,Men,Footwear,Shoes,Sports Shoes,Black,Fall,2011,Sports,Nike Men Air Press Black Sports Shoes
12696,Men,Footwear,Shoes,Sports Shoes,White,Fall,2011,Sports,Nike Men Transform White Sports Shoes
12697,Men,Footwear,Shoes,Sports Shoes,White,Fall,2011,Sports,Nike Men Egoli TF White Sports Shoes
12698,Men,Footwear,Shoes,Sports Shoes,Blue,Fall,2011,Sports,Nike Men Swift FG Blue Sports Shoes
12699,Men,Footwear,Shoes,Sports Shoes,Black,Fall,2011,Sports,Nike Men Lunarglide Black Sports Shoes
12700,Men,Footwear,Shoes,Sports Shoes,Black,Fall,2011,Sports,Nike Men Metallic Gold Black Sports Shoes
12701,Women,Footwear,Shoes,Sports Shoes,Blue,Fall,2011,Sports,Nike Women Lunarfly Blue Sports Shoes
12702,Women,Footwear,Shoes,Casual Shoes,White,Fall,2011,Casual,Nike Women Capri White Casual Shoes
12703,Women,Footwear,Shoes,Sports Shoes,White,Fall,2011,Sports,Nike Women Downshifter White Sports Shoes
12704,Men,Footwear,Shoes,Sports Shoes,Grey,Fall,2011,Sports,Nike Men Air Relentness Grey Sports Shoes
12705,Men,Footwear,Shoes,Sports Shoes,White,Fall,2011,Sports,Nike Men Air Courtballistic White Sports Shoes
12706,Men,Footwear,Shoes,Sports Shoes,White,Fall,2011,Sports,Nike Men Deep Red White Sports Shoes
12707,Men,Footwear,Shoes,Sports Shoes,White,Fall,2011,Sports,Nike Men Overplay White Sports Shoes
12708,Men,Footwear,Shoes,Sports Shoes,White,Fall,2011,Sports,Nike Men Lunareclipse White Sports Shoes
12709,Men,Footwear,Shoes,Sports Shoes,Grey,Fall,2011,Sports,Nike Men Air Impetus Grey Sports Shoes
12710,Men,Footwear,Shoes,Sports Shoes,Silver,Fall,2011,Sports,Nike Men Mercurial Victory Silver Sports Shoes
12711,Women,Footwear,Shoes,Sports Shoes,Grey,Fall,2011,Sports,Nike Women Lunarshift Grey Sports Shoes
12712,Women,Footwear,Shoes,Sports Shoes,Silver,Fall,2011,Sports,Nike Women Dual Fusion Silver Sports Shoes
12713,Women,Footwear,Shoes,Sports Shoes,Black,Fall,2011,Sports,Nike Women Air Dictate Black Sports Shoes
12714,Women,Footwear,Shoes,Sports Shoes,Silver,Fall,2011,Sports,Nike Women Air Cardio Silver Sports Shoes
12715,Women,Footwear,Shoes,Casual Shoes,Purple,Fall,2011,Casual,Nike Women Sweet Classic Purple Casual Shoes
12716,Men,Footwear,Shoes,Sports Shoes,Grey,Fall,2011,Sports,Nike Men Air Visi Pro Grey Sports Shoes
12717,Men,Footwear,Shoes,Casual Shoes,White,Fall,2011,Casual,Nike Men Backboard White Casual Shoes
12718,Men,Footwear,Shoes,Sports Shoes,White,Fall,2011,Sports,Nike Men Air Impetus II White Sports Shoes
12719,Women,Footwear,Shoes,Flats,Green,Fall,2011,Casual,Nike Women Butterfly Thong Green Flip Flops
12720,Unisex,Footwear,Sandal,Sandals,Black,Fall,2011,Casual,ADIDAS Unisex Casual Black Sandals
12721,Unisex,Footwear,Sandal,Sandals,Black,Fall,2011,Casual,ADIDAS Unisex Casual Black Sandals
12722,Unisex,Footwear,Sandal,Sandals,Brown,Fall,2011,Casual,ADIDAS Unisex Casual Brown Sandals
12723,Men,Footwear,Shoes,Sports Shoes,White,Fall,2011,Sports,ADIDAS Men Streak White Sports Shoes
12724,Men,Footwear,Shoes,Casual Shoes,Black,Fall,2011,Casual,ADIDAS Men Treklite Black Casual Shoes
12725,Men,Footwear,Shoes,Casual Shoes,Brown,Fall,2011,Casual,ADIDAS Men Anzo Breeze Brown Casual Shoes
12726,Men,Apparel,Topwear,Tshirts,Green,Fall,2011,Casual,Timberland Men Solid Green  Plo T-Shirts
12727,Men,Apparel,Topwear,Tshirts,Green,Fall,2011,Casual,Timberland Men Solid Green Polo T-Shirts
12728,Men,Apparel,Topwear,Tshirts,Maroon,Fall,2011,Casual,Timberland Men Printed Maroon Tshirts
12729,Men,Apparel,Topwear,Tshirts,Black,Fall,2011,Casual,Timberland Men Printed Black Tshirts
12730,Men,Apparel,Topwear,Sweatshirts,Blue,Fall,2011,Casual,Timberland Men Solid Blue Sweatshirts
12731,Men,Apparel,Topwear,Shirts,Green,Fall,2011,Casual,Timberland Men Check Green Shirts
12732,Unisex,Accessories,Bags,Backpacks,Black,Fall,2011,Sports,Nike Unisex Swoosh Black Backpack
12733,Women,Accessories,Bags,Handbags,Pink,Fall,2011,Sports,Nike Women Pinkaland Pink Handbags
12734,Women,Accessories,Bags,Handbags,Black,Fall,2011,Sports,Nike Women Samba Black Handbags
12735,Unisex,Accessories,Headwear,Caps,Black,Fall,2011,Sports,Nike Unisex U Black Caps
12736,Unisex,Accessories,Socks,Socks,Grey,Fall,2011,Sports,Nike Kids Sport Hi Quarter Pack of 3 Socks
12737,Women,Accessories,Socks,Socks,White,Fall,2011,Sports,Nike Women Sports White Socks
12739,Unisex,Accessories,Socks,Socks,Pink,Fall,2011,Sports,Nike Kids Unisex Sport Hi Quarter  Pack of 3 Pink Socks
12740,Unisex,Accessories,Bags,Backpacks,Black,Fall,2011,Casual,Timberland Unisex Solid Black Backpacks
12741,Unisex,Accessories,Bags,Backpacks,Black,Fall,2011,Casual,Timberland Unisex Solid Black Backpacks
12742,Unisex,Accessories,Bags,Backpacks,Black,Fall,2011,Casual,Timberland Unisex Solid Black Backpacks
12743,Unisex,Accessories,Bags,Messenger Bag,Olive,Fall,2011,Casual,Timberland Unisex Solid Olive Bags
12744,Unisex,Accessories,Bags,Laptop Bag,Beige,Fall,2011,Casual,Timberland Unisex Solid Beige Bags
12745,Unisex,Accessories,Bags,Messenger Bag,Olive,Fall,2011,Casual,Timberland Unisex Solid Olive Bags
12746,Men,Accessories,Scarves,Scarves,Navy Blue,Fall,2011,Casual,Timberland Men Solid Navy Blue Scarves
12747,Men,Accessories,Scarves,Scarves,Black,Fall,2011,Casual,Timberland Men Solid Black Scarves
12748,Men,Apparel,Bottomwear,Trousers,Black,Fall,2011,Casual,Timberland Men Solid Black Trousers
12750,Unisex,Accessories,Bags,Backpacks,Black,Summer,2012,Sports,Nike Unisex Swoosh Black Backpacks
12751,Men,Apparel,Bottomwear,Jeans,Blue,Fall,2011,Casual,Spykar Men Ep Jeans Blue Jeans
12752,Men,Apparel,Bottomwear,Jeans,Blue,Fall,2011,Casual,Spykar Men Ep Jeans Blue Jeans
12753,Men,Apparel,Bottomwear,Jeans,Black,Fall,2011,Casual,Spykar Men Ep Jeans Black Jeans
12754,Women,Apparel,Bottomwear,Jeans,Blue,Fall,2011,Casual,Spykar Women Ep Jeans Blue Jeans
12755,Men,Apparel,Topwear,Tshirts,Navy Blue,Fall,2011,Casual,Spykar Men Navy Striped Polo T-Shirt
12757,Men,Apparel,Topwear,Tshirts,Blue,Fall,2011,Casual,Spykar Men Printed Blue T-Shirts
12758,Men,Apparel,Bottomwear,Jeans,Blue,Fall,2011,Casual,Spykar Men Washed Blue Jeans
12759,Women,Apparel,Bottomwear,Jeans,Blue,Fall,2011,Casual,Spykar Women Washed Blue Jeans
12760,Women,Apparel,Bottomwear,Jeans,Blue,Summer,2011,Casual,Spykar Women Blue Washed Jeans
12762,Women,Apparel,Bottomwear,Jeans,Blue,Fall,2011,Casual,Spykar Women Washed Blue Jeans
12765,Women,Apparel,Bottomwear,Jeans,Black,Fall,2011,Casual,Spykar Women Washed Black Jeans
12766,Men,Apparel,Topwear,Tshirts,Navy Blue,Fall,2011,Casual,Spykar Men Stripe Navy Blue T-Shirts
12768,Women,Apparel,Topwear,Tunics,Green,Fall,2011,Ethnic,Mother Earth Women Plain Mangalgiri Green Tunics
12769,Women,Apparel,Topwear,Tops,Red,Fall,2011,Ethnic,Mother Earth Women Checks Red Shirts
12770,Women,Apparel,Topwear,Tops,Green,Fall,2011,Ethnic,Mother Earth Women Checks Green Shirts
12771,Women,Apparel,Topwear,Kurtas,Pink,Fall,2011,Ethnic,Mother Earth Women Chogun Aug Collt Pink Kurtas
12772,Women,Apparel,Topwear,Kurtas,Blue,Fall,2011,Ethnic,Mother Earth Women Classic Blue Kurtas
12773,Women,Apparel,Topwear,Tunics,Green,Fall,2011,Ethnic,Mother Earth Women Limited Collt Handloom Green Tunics
12774,Women,Apparel,Topwear,Kurtas,Green,Fall,2011,Ethnic,Mother Earth Women 2Tone Mangalgiri Green Kurtas
12775,Women,Apparel,Topwear,Kurtas,Blue,Fall,2011,Ethnic,Mother Earth Women Chogun Aug Collt Blue Kurtas
12776,Women,Apparel,Topwear,Kurtas,Blue,Fall,2011,Ethnic,Mother Earth Women Shilpis Collt Blue Kurtas
12777,Women,Apparel,Topwear,Kurtas,Yellow,Fall,2011,Ethnic,Mother Earth Women Collt Organic Cotton Yellow Kurtas
12778,Women,Apparel,Topwear,Kurtas,Black,Fall,2011,Ethnic,Mother Earth Women Collt Organic Cotton Black Kurtas
12779,Women,Apparel,Topwear,Kurtas,Maroon,Fall,2011,Ethnic,Mother Earth Women Aug Bagru Maroon & Black Kurta
12780,Women,Apparel,Apparel Set,Kurta Sets,Brown,Fall,2011,Ethnic,Mother Earth Women Cotton Brown Salwar Suit
12781,Women,Apparel,Apparel Set,Kurta Sets,Black,Fall,2011,Ethnic,Mother Earth Women Cotton Black Salwar Suit
12782,Women,Apparel,Topwear,Kurtas,Red,Fall,2011,Ethnic,Mother Earth Women Aug Bagru Red Kurtas
12783,Women,Apparel,Topwear,Kurtas,Red,Fall,2011,Ethnic,Mother Earth Women Aug Bagru Red Kurtas
12784,Women,Apparel,Topwear,Kurtas,Red,Fall,2011,Ethnic,Mother Earth Women Kalamkari Red Kurtas
12785,Women,Apparel,Topwear,Tops,Pink,Fall,2011,Ethnic,Mother Earth Women Checks Pink Shirts
12786,Women,Apparel,Topwear,Kurtas,Green,Fall,2011,Ethnic,Mother Earth Women Renu Green Kurtas
12787,Women,Apparel,Topwear,Kurtas,Red,Fall,2011,Ethnic,Mother Earth Women Renu Red Kurtas
12788,Women,Apparel,Topwear,Kurtis,Pink,Fall,2011,Ethnic,Mother Earth Women Renu Pink Kurtis
12789,Women,Apparel,Topwear,Kurtas,White,Fall,2011,Ethnic,Mother Earth Women Sajiya Collt White Kurtas
12790,Men,Apparel,Topwear,Tshirts,Red,Summer,2012,Sports,Nike Men Arsenal Red Jersey
12791,Men,Apparel,Topwear,Tshirts,Red,Fall,2011,Sports,Nike Men Manchester United Red Jerseys
12792,Men,Apparel,Topwear,Tshirts,Black,Fall,2011,Sports,Nike Men Manchester United Black Jersey
12793,Women,Apparel,Topwear,Tshirts,Maroon,Fall,2011,Casual,Nike Women Blue Grafitti Maroon Tshirts
12794,Women,Apparel,Topwear,Tshirts,Pink,Fall,2011,Casual,Nike Women White Print Pink Tshirts
12795,Men,Apparel,Topwear,Tshirts,Yellow,Fall,2011,Casual,Nike Men Brazil Yellow Tshirts
12796,Women,Apparel,Topwear,Tshirts,Black,Fall,2011,Casual,Nike Women Grafitti Black T-shirt
12797,Men,Apparel,Topwear,Tshirts,Black,Fall,2011,Sports,Nike Men The Red Devils Black Tshirts
12798,Men,Apparel,Topwear,Tshirts,Navy Blue,Fall,2011,Sports,Nike Men Arsenal Navy Blue Jersey
12799,Men,Apparel,Topwear,Tshirts,Blue,Fall,2011,Sports,Nike Men Blue Manchester United Jersey
12800,Men,Apparel,Topwear,Tshirts,Grey,Fall,2011,Sports,Nike Men Basketball Jersey Grey Jerseys
12801,Men,Apparel,Topwear,Tshirts,Red,Fall,2011,Sports,Nike Men Red Manchester United Jersey
12802,Women,Apparel,Topwear,Tshirts,Green,Fall,2011,Casual,Nike Women Flower Green Tshirts
12803,Women,Apparel,Topwear,Tshirts,Pink,Fall,2011,Casual,Nike Women Polka Dot Grafitti Pink T-shirt
12804,Men,Apparel,Topwear,Tshirts,Green,Fall,2011,Casual,Nike Men Green Polo Tshirts
12805,Men,Apparel,Topwear,Tshirts,Grey,Fall,2011,Casual,Nike Men Grey Polo Tshirts
12806,Men,Apparel,Topwear,Sweatshirts,Grey,Fall,2011,Sports,Nike Men Zip Grey Sweatshirts
12807,Women,Apparel,Topwear,Jackets,Pink,Fall,2011,Sports,Nike Women Hood Pink Jackets
12808,Men,Apparel,Topwear,Jackets,Blue,Fall,2011,Sports,Nike Men Zip Pocket Blue Jackets
12809,Men,Apparel,Topwear,Jackets,Black,Fall,2011,Sports,Nike Men Hood Black Jacket
12810,Women,Apparel,Bottomwear,Track Pants,Black,Fall,2011,Sports,Nike Women Trainng Black Track Pants
12811,Men,Apparel,Bottomwear,Track Pants,Black,Summer,2012,Sports,Nike Men Dri-Fit Black Track Pants
12812,Men,Apparel,Bottomwear,Shorts,Black,Summer,2012,Sports,Nike Men Football/Soccer Black Shorts
12813,Men,Footwear,Shoes,Casual Shoes,White,Fall,2011,Casual,Nike Men Sports White Casual Shoes
12814,Unisex,Footwear,Shoes,Casual Shoes,Navy Blue,Fall,2011,Casual,Puma Unisex 917 Lo Navy Blue Casual Shoes
12816,Men,Footwear,Shoes,Casual Shoes,Black,Fall,2011,Casual,Fila Men Driving Velcro Black Casual Shoes
12817,Men,Footwear,Sandal,Sandals,Grey,Fall,2011,Casual,Puma Men Snipper Grey Sandals
12819,Men,Footwear,Shoes,Sports Shoes,White,Fall,2011,Sports,Nike Men Air Impetus White Shoes
12820,Unisex,Footwear,Flip Flops,Flip Flops,Red,Fall,2011,Casual,Puma Unisex Surf Red Slippers
12821,Women,Footwear,Shoes,Casual Shoes,Blue,Fall,2011,Casual,Puma Women Karlie Blur Wn's Dazzling Blue Casual Shoes
12822,Men,Footwear,Sandal,Sandals,Black,Fall,2011,Casual,Puma Men Snipper Black Sandals
12823,Men,Footwear,Shoes,Casual Shoes,Yellow,Fall,2011,Casual,Lotto Men Dynamo Yellow Casual Shoes
12824,Women,Footwear,Shoes,Casual Shoes,Black,Fall,2011,Casual,Nike Women Flyclave Black Casual Shoes
12825,Unisex,Footwear,Flip Flops,Flip Flops,Black,Fall,2011,Casual,Puma Unisex Coral Black Slippers
12826,Men,Apparel,Topwear,Shirts,White,Fall,2011,Casual,Spykar Men Check White Shirts
12827,Men,Apparel,Topwear,Shirts,White,Fall,2011,Casual,Spykar Men Check White Shirts
12828,Men,Apparel,Bottomwear,Jeans,Blue,Fall,2011,Casual,Spykar Men Washed Blue Jeans
12829,Men,Apparel,Bottomwear,Tracksuits,Navy Blue,Fall,2011,Sports,Nike Men Stripe Navy Blue Tracksuits
12830,Women,Apparel,Dress,Dresses,Green,Fall,2011,Casual,Ant Kids Peaceful Day Green Dresses
12831,Women,Apparel,Topwear,Tops,Pink,Fall,2011,Casual,Ant Kids Pink Tops
12832,Men,Apparel,Topwear,Tshirts,Blue,Fall,2011,Casual,Ant Kids I Ate Blue Tshirts
12833,Men,Apparel,Topwear,Tshirts,Green,Fall,2011,Casual,Ant Kids Spirit Green Tshirts
12834,Unisex,Apparel,Topwear,Tshirts,Blue,Fall,2011,Casual,Ant Unisex Cute Chick Blue Tshirts
12835,Women,Apparel,Dress,Dresses,Orange,Fall,2011,Casual,Ant Kids Flower Orange Dresses
12836,Men,Apparel,Topwear,Tshirts,Green,Fall,2011,Casual,Ant Kids Tennis Green T-Shirt
12837,Women,Apparel,Dress,Dresses,Pink,Fall,2011,Casual,Ant Kids Button Bow Pink Dresses
12838,Unisex,Apparel,Topwear,Tshirts,White,Fall,2011,Casual,Ant Unisex Bebo White Tshirts
12839,Women,Apparel,Bottomwear,Skirts,Black,Fall,2011,Casual,Ant Kids Pleated Black Skirts
12840,Boys,Apparel,Topwear,Tshirts,Brown,Fall,2011,Casual,Ant Kids Brown Striped T-Shirt
12841,Men,Apparel,Topwear,Tshirts,Grey,Fall,2011,Casual,Ant Kids Multi Colour Grey Tshirts
12842,Men,Apparel,Topwear,Tshirts,Navy Blue,Fall,2011,Casual,Ant Kids Warrior Kids Navy Blue Tshirts
12843,Men,Apparel,Topwear,Tshirts,Navy Blue,Fall,2011,Casual,Ant Kids Keep Up Navy Blue Tshirts
12844,Boys,Apparel,Topwear,Tshirts,Multi,Fall,2011,Casual,Ant Kids Boys Multicoloured Striped T-shirts
12845,Boys,Apparel,Topwear,Tshirts,Maroon,Fall,2011,Casual,Ant Kids Boys Arrow Maroon Tshirts
12846,Boys,Apparel,Topwear,Tshirts,Grey,Fall,2011,Casual,Ant Kids Boys Rock Grey Tshirts
12847,Boys,Apparel,Topwear,Tshirts,Black,Fall,2011,Casual,Ant Kids Boys National Champion Black Tshirts
12848,Women,Apparel,Bottomwear,Skirts,Blue,Fall,2011,Casual,Ant Kids Check Blue Skirts
12849,Girls,Apparel,Dress,Dresses,White,Fall,2011,Casual,Ant Kids Girls Butterfly Print White Dresses
12850,Women,Apparel,Topwear,Tops,Green,Fall,2011,Casual,Ant Kids Girl Cheerful Green Tops
12851,Women,Apparel,Topwear,Tops,Black,Fall,2011,Casual,Ant Kids Crystal Button Black Tops
