id,gender,masterCategory,subCategory,articleType,baseColour,season,year,usage,productDisplayName
13430,Men,Apparel,Topwear,Tshirts,Yellow,Summer,2011,Casual,United Colors of Benetton Men Printed Yellow Tshirts
13432,Men,Apparel,Topwear,Tshirts,White,Summer,2011,Casual,United Colors of Benetton Men Printed White Tshirts
13433,Men,Apparel,Topwear,Tshirts,Blue,Summer,2011,Casual,United Colors of Benetton Men Stripes Blue Tshirts
13434,Men,Apparel,Topwear,Tshirts,Yellow,Summer,2011,Casual,United Colors of Benetton Men Solid Yellow Tshirts
13435,Men,Apparel,Topwear,Tshirts,Blue,Summer,2011,Casual,United Colors of Benetton Men Stripes Blue Tshirts
13436,Men,Apparel,Topwear,Tshirts,Green,Summer,2011,Casual,United Colors of Benetton Men Stripes Green Tshirts
13437,Men,Apparel,Topwear,Tshirts,Grey,Summer,2011,Casual,United Colors of Benetton Men Stripes Grey Polo T-shirts
13438,Men,Apparel,Topwear,Tshirts,Blue,Summer,2011,Casual,United Colors of Benetton Men Solid Blue Polo T-shirts
13439,Men,Apparel,Topwear,Tshirts,Green,Summer,2011,Casual,United Colors of Benetton Men Solid Green Polo T-shirts
13440,Men,Apparel,Topwear,Tshirts,Grey,Summer,2011,Casual,United Colors of Benetton Men Printed Grey Tshirts
13441,Men,Apparel,Topwear,Tshirts,White,Summer,2011,Casual,United Colors of Benetton Men Printed White Tshirts
13442,Women,Apparel,Topwear,Tops,White,Summer,2011,Casual,United Colors of Benetton Women Solid White Tops
13443,Women,Apparel,Topwear,Tops,White,Summer,2011,Casual,United Colors of Benetton Women Solid White Tops
13444,Women,Apparel,Topwear,Tops,Yellow,Summer,2011,Casual,United Colors of Benetton Women Printed Yellow Tops
13445,Women,Apparel,Topwear,Tops,White,Summer,2011,Casual,United Colors of Benetton Women Printed White Tops
13446,Women,Apparel,Topwear,Tops,Pink,Summer,2011,Casual,United Colors of Benetton Women Stripes Pink Tops
13447,Men,Apparel,Topwear,Tshirts,Pink,Summer,2011,Casual,United Colors of Benetton Men Stripes Pink Tshirts
13448,Women,Apparel,Topwear,Shirts,Pink,Summer,2011,Casual,United Colors of Benetton Women Solid Pink Shirts
13449,Women,Apparel,Topwear,Shirts,Black,Summer,2011,Casual,United Colors of Benetton Women Solid Black Shirts
13450,Women,Apparel,Topwear,Shirts,White,Summer,2011,Casual,United Colors of Benetton Women Solid White Shirts
13451,Women,Apparel,Topwear,Shirts,Pink,Summer,2011,Casual,United Colors of Benetton Women Check Pink Shirts
13452,Women,Apparel,Topwear,Shirts,Green,Summer,2011,Casual,United Colors of Benetton Women Check Green Shirts
13453,Women,Apparel,Topwear,Tunics,Blue,Summer,2011,Casual,United Colors of Benetton Women Printed Blue Tunics
13454,Women,Apparel,Topwear,Tshirts,Pink,Summer,2011,Casual,United Colors of Benetton Women Pink Polo T-shirts
13455,Women,Apparel,Topwear,Tshirts,White,Summer,2011,Casual,United Colors of Benetton Women White Polo T-shirts
13456,Women,Apparel,Topwear,Tops,Pink,Summer,2011,Casual,United Colors of Benetton Women Solid Pink Tops
13457,Women,Apparel,Topwear,Shirts,White,Summer,2011,Casual,United Colors of Benetton Women Solid White Shirts
13458,Women,Apparel,Topwear,Shirts,Black,Summer,2011,Casual,United Colors of Benetton Women Solid Black Shirts
13459,Men,Apparel,Topwear,Shirts,Blue,Summer,2011,Casual,United Colors of Benetton Men Check Blue Shirts
13460,Men,Apparel,Topwear,Shirts,Green,Summer,2011,Casual,United Colors of Benetton Men Solid Green Shirts
13461,Men,Apparel,Topwear,Shirts,Black,Summer,2011,Casual,United Colors of Benetton Men Check Black Shirts
13462,Men,Apparel,Topwear,Tshirts,Green,Summer,2011,Casual,United Colors of Benetton Men Stripes Green Tshirts
13463,Men,Apparel,Topwear,Shirts,Blue,Summer,2011,Casual,United Colors of Benetton Men Check Blue Shirts
13464,Men,Apparel,Topwear,Shirts,Blue,Summer,2011,Casual,United Colors of Benetton Men Solid Blue Shirts
13465,Men,Apparel,Topwear,Tshirts,Purple,Summer,2011,Casual,United Colors of Benetton Men Stripes Purple Polo T-shirts
13466,Men,Apparel,Topwear,Tshirts,Blue,Summer,2011,Casual,United Colors of Benetton Men Stripes Blue Tshirts
13467,Men,Apparel,Topwear,Tshirts,White,Summer,2011,Casual,United Colors of Benetton Men Printed White Tshirts
13468,Men,Apparel,Topwear,Tshirts,Green,Summer,2011,Casual,United Colors of Benetton Men Solid Green Tshirts
13469,Men,Apparel,Topwear,Tshirts,Pink,Fall,2011,Casual,United Colors of Benetton Men Printed Pink Tops
13470,Women,Apparel,Dress,Dresses,Pink,Summer,2011,Casual,United Colors of Benetton Women Solid Pink Dress
13471,Women,Apparel,Topwear,Tops,Blue,Summer,2011,Casual,United Colors of Benetton Women Solid Blue Tunic
13472,Women,Apparel,Dress,Dresses,White,Summer,2011,Casual,United Colors of Benetton Women Solid White Dress
13473,Women,Footwear,Shoes,Flats,White,Winter,2012,Casual,Rocia Women White Heels
13474,Women,Footwear,Shoes,Flats,Gold,Fall,2011,Casual,Rocia Women Gold Toned Flats
13475,Women,Footwear,Shoes,Flats,Brown,Winter,2014,Casual,Rocia Women Brown Flats
13476,Women,Footwear,Shoes,Flats,Tan,Spring,2013,Casual,Rocia Women Brown Flats
13477,Women,Footwear,Shoes,Casual Shoes,Black,Winter,2012,Casual,Rocia Women Rocia Black Sandal Black Shoes
13478,Women,Footwear,Shoes,Flats,Black,Winter,2012,Casual,Rocia Women Black Flats
13479,Women,Footwear,Shoes,Flats,White,Fall,2011,Casual,Rocia Women White Flats
13480,Women,Footwear,Shoes,Flats,Black,Spring,2013,Casual,Rocia Women Black Flats
13481,Women,Footwear,Shoes,Flats,Black,Fall,2011,Casual,Rocia Women Black Flats
13482,Women,Footwear,Shoes,Flats,Black,Winter,2012,Casual,Rocia Women Black Flats
13483,Women,Footwear,Shoes,Flats,White,Winter,2012,Casual,Rocia Women White & Black Flats
13484,Women,Footwear,Shoes,Casual Shoes,White,Winter,2012,Casual,Rocia Women Rocia White  Sandal White Shoes
13485,Women,Footwear,Shoes,Heels,Black,Fall,2011,Formal,Rocia Women Rocia Black Formal Shoe Black Formal Shoes
13486,Men,Apparel,Topwear,Shirts,White,Summer,2011,Casual,United Colors of Benetton Men Stripes White Shirts
13487,Men,Apparel,Topwear,Shirts,Blue,Fall,2011,Casual,Spykar Men Stripes Blue Shirts
13489,Men,Apparel,Topwear,Tshirts,Navy Blue,Fall,2011,Casual,FIFA Men Printed Navy Blue T-shirts
13490,Men,Apparel,Bottomwear,Shorts,Blue,Fall,2011,Casual,ADIDAS Men Solid Blue Shorts
13491,Women,Apparel,Topwear,Tshirts,Purple,Fall,2011,Casual,Inkfruit Women Printed Purple Tshirts
13493,Unisex,Accessories,Bags,Rucksacks,Red,Winter,2015,Travel,Wildcraft Unisex Gangotri Black & Red Rucksack
13494,Men,Apparel,Topwear,Tshirts,White,Fall,2011,Casual,Nike Men Manchester United White Tshirts
13495,Men,Apparel,Topwear,Tshirts,Yellow,Fall,2011,Casual,Chimp Men Shit Happens Yellow Tshirts
13496,Men,Apparel,Topwear,Tshirts,Blue,Fall,2011,Casual,Chimp Men Teja Main Hoon Blue Tshirts
13497,Men,Apparel,Topwear,Tshirts,Blue,Fall,2011,Casual,Chimp Men Rajni Blue Tshirts
13498,Men,Apparel,Topwear,Tshirts,Blue,Fall,2011,Casual,Chimp Men Bai Cycle Blue Tshirts
13499,Men,Apparel,Topwear,Tshirts,Blue,Fall,2011,Casual,Chimp Men Mard ban Blue Tshirts
13500,Men,Apparel,Topwear,Tshirts,Grey,Fall,2011,Casual,Chimp Men VVVIP Grey T-shirts
13501,Men,Apparel,Topwear,Tshirts,White,Fall,2011,Casual,Chimp Men Daku Mentatry White Tshirts
13502,Men,Apparel,Topwear,Tshirts,Blue,Fall,2011,Casual,Chimp Men Baloon Boy Blue Tshirts
13503,Men,Apparel,Topwear,Tshirts,Green,Fall,2011,Casual,Chimp Men AAA-CHHE Green T-shirts
13504,Men,Apparel,Topwear,Tshirts,White,Fall,2011,Casual,Chimp Men Kutta Pyjama White Tshirts
13505,Men,Apparel,Topwear,Tshirts,Green,Fall,2011,Casual,Chimp Men Ravan Green Tshirts
13506,Men,Apparel,Topwear,Tshirts,White,Fall,2011,Casual,Chimp Men Color me Happy White Tshirts
13507,Men,Apparel,Topwear,Tshirts,Green,Fall,2011,Casual,Chimp Men Smart Ass Green Tshirts
13508,Men,Apparel,Topwear,Tshirts,Grey,Fall,2011,Casual,Chimp Men Who's your papaji Grey Tshirts
13509,Men,Apparel,Topwear,Tshirts,Blue,Fall,2011,Casual,Chimp Men Are you Soor Blue Tshirts
13510,Men,Apparel,Topwear,Tshirts,Green,Fall,2011,Casual,Chimp Men Say Cheese Green Tshirts
13511,Men,Apparel,Topwear,Tshirts,White,Fall,2011,Casual,Chimp Men Mumbai Opens White Tshirts
13513,Men,Apparel,Topwear,Tshirts,Grey,Fall,2011,Casual,Chimp Men Firee Grey Tshirts
13514,Women,Apparel,Bottomwear,Skirts,Blue,Fall,2011,Casual,Palm Tree Women Washed Blue Skirts
13515,Women,Apparel,Bottomwear,Skirts,Blue,Fall,2011,Casual,Palm Tree Kids Girl Washed Blue Skirts
13516,Women,Apparel,Bottomwear,Skirts,Blue,Fall,2011,Casual,Palm Tree Kids Girl Washed Blue Skirts
13517,Men,Apparel,Topwear,Tshirts,Yellow,Fall,2011,Casual,Chimp Men Draculla & Sons Yellow Tshirts
13518,Men,Apparel,Topwear,Shirts,Blue,Fall,2011,Casual,Probase Men Stripes Blue Shirts
13519,Men,Apparel,Topwear,Sweatshirts,White,Fall,2011,Casual,Spykar Men Stripes White Sweatshirts
13520,Women,Apparel,Topwear,Sweaters,Purple,Fall,2011,Casual,Jealous 21 Women Solid Purple Sweaters
13521,Women,Apparel,Topwear,Tops,Grey,Fall,2011,Casual,Jealous 21 Women Solid Grey Tops
13522,Women,Apparel,Topwear,Tops,Green,Fall,2011,Casual,Jealous 21 Women Solid Green Tops
13523,Women,Apparel,Topwear,Tops,Pink,Fall,2011,Casual,Jealous 21 Women Printed Pink Tops
13524,Women,Apparel,Topwear,Tops,Purple,Fall,2011,Casual,Jealous 21 Women Solid Purple Tops
13525,Women,Apparel,Topwear,Tunics,White,Fall,2011,Casual,Scullers For Her Women Instyle White Tunics
13527,Women,Apparel,Topwear,Shirts,White,Fall,2011,Casual,Scullers For Her Women Lightwork White Shirts
13528,Men,Apparel,Bottomwear,Trousers,Navy Blue,Fall,2011,Casual,Probase Navy Blue Printed Trousers
13529,Men,Apparel,Topwear,Tshirts,Blue,Fall,2011,Casual,Spykar Blue Stripes Tshirt
13530,Men,Accessories,Mufflers,Mufflers,Navy Blue,Fall,2011,Casual,Scullers Green Stripe Muffler
13531,Men,Accessories,Mufflers,Mufflers,Black,Fall,2011,Casual,Scullers Red Stripe Muffler
13532,Men,Footwear,Shoes,Sports Shoes,Blue,Fall,2011,Sports,ADIDAS Blue Resp Trail 18 M Sports Shoe
13533,Women,Footwear,Shoes,Casual Shoes,Pink,Fall,2011,Casual,ADIDAS Pink Adi light Casual Shoe
13534,Men,Footwear,Shoes,Sports Shoes,Black,Fall,2011,Sports,ADIDAS Black Adizero mana 6 wide Sports Shoe
13535,Men,Footwear,Shoes,Sports Shoes,White,Fall,2011,Sports,ADIDAS Men Response Cushion White Sports Shoes
13536,Men,Footwear,Sandal,Sports Sandals,Black,Spring,2013,Casual,ADIDAS Men Black Receptor Sports Sandal
13537,Men,Footwear,Shoes,Casual Shoes,Brown,Fall,2011,Casual,Carlton London Men Casual Brown Casual Shoes
13538,Men,Footwear,Shoes,Casual Shoes,Black,Winter,2012,Casual,Carlton London Men Casual Black Casual Shoes
13539,Women,Footwear,Shoes,Heels,Gold,Spring,2013,Casual,Carlton London Women Casual Gold Flats
13540,Men,Footwear,Shoes,Casual Shoes,White,Fall,2011,Casual,Carlton London Men Casual White Casual Shoes
13541,Women,Footwear,Shoes,Flats,Purple,Fall,2011,Casual,Carlton London Women Casual Purple Sandals
13542,Women,Footwear,Shoes,Flats,Brown,Fall,2011,Casual,Carlton London Women Casual Brown Sandals
13543,Women,Footwear,Shoes,Heels,Red,Winter,2012,Casual,Carlton London Women Casual Red Flats
13544,Women,Footwear,Shoes,Flats,Coffee Brown,Winter,2012,Casual,Carlton London Women Coffee Brown Desert Boots
13545,Women,Footwear,Shoes,Flats,Black,Fall,2011,Casual,Carlton London Women Casual Black Sandals
13546,Women,Footwear,Shoes,Flats,Gold,Spring,2013,Casual,Carlton London Women Gold Toned Flats
13547,Women,Footwear,Shoes,Casual Shoes,Red,Fall,2011,Casual,Carlton London Women Casual Red Casual Shoes
13548,Women,Footwear,Shoes,Heels,Green,Spring,2013,Casual,Carlton London Women Casual Green Flats
13549,Women,Footwear,Shoes,Casual Shoes,Grey,Spring,2013,Casual,Carlton London Women Casual Grey Casual Shoes
13550,Women,Footwear,Shoes,Flats,Tan,Fall,2011,Casual,Carlton London Women Casual Tan Sandals
13551,Women,Footwear,Shoes,Heels,Gold,Winter,2012,Casual,Carlton London Women Casual Gold Flats
13552,Women,Footwear,Shoes,Flats,Yellow,Winter,2012,Casual,Carlton London Women Yellow Flat Shoes
13553,Women,Footwear,Shoes,Heels,Brown,Fall,2011,Casual,Carlton London Brown Flats
13554,Women,Footwear,Shoes,Flats,Pink,Fall,2011,Casual,Carlton London Women Casual Pink Sandals
13555,Women,Footwear,Shoes,Casual Shoes,Red,Fall,2011,Casual,Carlton London Women Casual Red Casual Shoes
13556,Women,Footwear,Shoes,Heels,Yellow,Spring,2013,Casual,Carlton London Women Casual Yellow Flats
13557,Women,Footwear,Shoes,Flats,Gold,Fall,2011,Casual,Carlton London Women Casual Gold Sandals
13558,Women,Footwear,Shoes,Flats,Navy Blue,Winter,2012,Casual,Carlton London Women Navy Blue Flat Shoes
13559,Women,Footwear,Shoes,Heels,Black,Spring,2013,Casual,Carlton London Women Casual Black Flats
13560,Women,Footwear,Shoes,Flats,Yellow,Fall,2011,Casual,Carlton London Women Casual Yellow Sandals
13561,Women,Footwear,Shoes,Flats,Black,Winter,2012,Casual,Carlton London Women Black Flat Shoes
13562,Women,Footwear,Shoes,Heels,Purple,Spring,2013,Casual,Carlton London Women Casual Purple Flats
13563,Women,Footwear,Shoes,Casual Shoes,Black,Fall,2011,Casual,Nike Black Flyclave Casual Shoe
13564,Men,Apparel,Innerwear,Innerwear Vests,Grey,Summer,2016,Casual,Hanes Men Square Vest Neck Grey Innerwear Vests
13565,Men,Apparel,Innerwear,Innerwear Vests,White,Summer,2016,Casual,Hanes Men Racer Back White Innerwear Vests
13566,Men,Apparel,Innerwear,Innerwear Vests,Grey,Summer,2016,Casual,Hanes Men Racer Back Grey Innerwear Vests
13567,Men,Apparel,Innerwear,Innerwear Vests,Black,Summer,2016,Casual,Hanes Men Racer Back Black Innerwear Vests
13568,Men,Apparel,Innerwear,Innerwear Vests,Grey,Summer,2016,Casual,Hanes Men Racer Back Grey Innerwear Vests
13569,Men,Apparel,Innerwear,Innerwear Vests,Navy Blue,Summer,2016,Casual,Hanes Men Racer Back Navy Blue Innerwear Vests
13570,Men,Apparel,Innerwear,Innerwear Vests,Black,Summer,2016,Casual,Hanes Men Racer Back Black Innerwear Vests
13571,Men,Apparel,Innerwear,Innerwear Vests,Red,Summer,2016,Casual,Hanes Men Racer Back Red Innerwear Vests
13572,Men,Apparel,Innerwear,Innerwear Vests,Red,Summer,2016,Casual,Hanes Men Racer Back Red Innerwear Vests
13573,Men,Apparel,Innerwear,Innerwear Vests,White,Summer,2016,Casual,Hanes Men Square Vest Neck White Innerwear Vests
13574,Men,Apparel,Innerwear,Innerwear Vests,White,Summer,2016,Casual,Hanes Men Rib Chest White Innerwear Vests
13576,Men,Apparel,Innerwear,Innerwear Vests,White,Summer,2016,Casual,Hanes Men Jersey VestPack Of 2 White Innerwear Vests
13578,Men,Apparel,Innerwear,Innerwear Vests,Red,Summer,2016,Casual,Hanes Men Pack of 2 Half Contrast Piping Ringer T-shirts
13580,Men,Apparel,Innerwear,Innerwear Vests,White,Summer,2016,Casual,Hanes Men Pack of 2 Half Contrast Piping Ringer T-shirts
13582,Men,Apparel,Innerwear,Innerwear Vests,White,Summer,2016,Casual,Hanes Men Pack of 2 Half Contrast Piping Ringer T-shirts
13584,Men,Apparel,Innerwear,Innerwear Vests,Beige,Summer,2016,Casual,Hanes Men Half Sleeve Crew Pack of 3 Beige Innerwear T-shirts
13587,Men,Apparel,Innerwear,Innerwear Vests,Grey,Summer,2016,Casual,Hanes Men Half Sleeve Crew Pack of 3 Grey Innerwear T-shirts
13590,Men,Apparel,Innerwear,Innerwear Vests,Green,Summer,2016,Casual,Hanes Men Half Sleeve Pack of 3 Innerwear T-shirts
13593,Men,Apparel,Innerwear,Innerwear Vests,Grey,Summer,2016,Casual,Hanes Men Half Sleeve Crew Pack of 3 Grey Innerwear T-shirts
13596,Men,Apparel,Innerwear,Innerwear Vests,Black,Summer,2016,Casual,Hanes Men Black Crew Pack Of 3 Innerwear T-Shirts
13599,Men,Apparel,Innerwear,Innerwear Vests,Red,Summer,2016,Casual,Hanes Men Half Sleeve Crew Pack of 3 Red Innerwear T-shirts
13602,Men,Apparel,Innerwear,Innerwear Vests,White,Summer,2016,Casual,Hanes Men Half Sleeve Crew Pack of 3 White Innerwear T-shirts
13605,Men,Apparel,Innerwear,Innerwear Vests,White,Summer,2016,Casual,Hanes Men Sleeveless Crew White Innerwear T-shirt
13607,Men,Apparel,Innerwear,Innerwear Vests,Grey,Summer,2016,Casual,Hanes Men Sleeveless Crew Grey Innerwear T-shirt
13609,Men,Apparel,Innerwear,Innerwear Vests,Red,Summer,2016,Casual,Hanes Men Sleeveless Crew Red Innerwear T-shirt
13611,Men,Apparel,Innerwear,Innerwear Vests,White,Summer,2016,Casual,Hanes Men Sleeveless V Neck White Grey Innerwear T-shirt
13613,Men,Apparel,Innerwear,Innerwear Vests,Red,Summer,2016,Casual,Hanes Men Sleeveless V Neck Red Innerwear T-shirt
13615,Men,Apparel,Innerwear,Innerwear Vests,Grey,Summer,2016,Casual,Hanes Men Grey V DuoDry Body Fit V-Neck T-shirt
13616,Men,Apparel,Innerwear,Innerwear Vests,Blue,Summer,2016,Casual,Hanes Men Blue V DuoDry Body Fit V-Neck T-shirt
13617,Men,Apparel,Innerwear,Innerwear Vests,Black,Summer,2016,Casual,Hanes Men Black V DuoDry Body Fit V-Neck T-shirt
13618,Men,Apparel,Innerwear,Innerwear Vests,Black,Summer,2016,Casual,Hanes Men Black Muscle Duo Dry Cotton Stretch Muscle T-shirt
13619,Women,Apparel,Innerwear,Innerwear Vests,White,Winter,2015,Casual,Hanes Women Short Sleeve White Innerwear T-shirt
13621,Men,Apparel,Loungewear and Nightwear,Lounge Shorts,Grey,Summer,2016,Casual,Hanes Men Knitted Grey Shorts
13624,Men,Apparel,Loungewear and Nightwear,Lounge Shorts,Red,Summer,2016,Casual,Hanes Men Knitted Red Shorts
13627,Men,Apparel,Loungewear and Nightwear,Lounge Shorts,Blue,Summer,2016,Casual,Hanes Men Knitted Blue Shorts
13630,Men,Apparel,Loungewear and Nightwear,Lounge Shorts,Black,Summer,2016,Casual,Hanes Men Knitted Black Shorts
13632,Men,Apparel,Loungewear and Nightwear,Lounge Shorts,Red,Summer,2016,Casual,Hanes Men Red Knitted Athletic 3/4th Pants
13634,Women,Apparel,Loungewear and Nightwear,Lounge Pants,White,Winter,2015,Casual,Hanes Women White Lounge Pants
13635,Men,Apparel,Innerwear,Innerwear Vests,Red,Summer,2016,Casual,Hanes Men Red Premium Sleeveless Crew T-shirt
13637,Men,Apparel,Innerwear,Innerwear Vests,Grey,Summer,2016,Casual,Hanes Men Grey Premium Sleeveless Crew T-shirt
13639,Men,Apparel,Innerwear,Innerwear Vests,Blue,Summer,2016,Casual,Hanes Men Blue Crew Duo Dry Body Fit Crew T-shirt
13640,Women,Footwear,Shoes,Flats,Purple,Winter,2012,Casual,Carlton London Women Purple Flat Shoes
13641,Women,Footwear,Shoes,Heels,Navy Blue,Winter,2012,Casual,Carlton London Women Casual Navy Flats
13642,Men,Footwear,Shoes,Casual Shoes,Brown,Fall,2011,Casual,Carlton London Brown  Casual Shoe
13643,Women,Footwear,Shoes,Flats,Gold,Fall,2011,Casual,Carlton London Women Casual Yellow Sandals
13644,Women,Footwear,Shoes,Heels,Silver,Fall,2011,Casual,Carlton London Women Casual Silver Flats
13645,Women,Footwear,Shoes,Flats,Brown,Fall,2011,Casual,Carlton London Women Casual Brown Sandals
13646,Men,Footwear,Shoes,Casual Shoes,Beige,Fall,2011,Casual,Carlton London Men Casual Beige Casual Shoes
13648,Men,Footwear,Shoes,Sports Shoes,Silver,Fall,2011,Sports,ADIDAS Silver Astar ride 3M Sports Shoe
13649,Men,Footwear,Shoes,Casual Shoes,Black,Fall,2011,Casual,ADIDAS Black Hydroterra Shandal Casual Shoes
13650,Men,Footwear,Shoes,Sports Shoes,White,Fall,2011,Sports,ADIDAS White  Snova Sequence 4M Sports Shoe
13651,Men,Footwear,Shoes,Sports Shoes,Black,Fall,2011,Sports,ADIDAS Black Tip Off 2 Sports Shoe
13652,Men,Footwear,Shoes,Sports Shoes,White,Fall,2011,Sports,ADIDAS White  Snova Sequence 4M Sports Shoe
13653,Men,Footwear,Shoes,Casual Shoes,Brown,Fall,2011,Casual,ADIDAS Brown Agora Lea Casual Shoe
13654,Men,Footwear,Shoes,Casual Shoes,Black,Fall,2011,Casual,ADIDAS Black Speed Boat Casual Shoe
13655,Men,Footwear,Sandal,Sandals,Red,Fall,2011,Casual,ADIDAS Red WhirItech Slide M Sandal
13656,Men,Footwear,Shoes,Sports Shoes,Black,Fall,2011,Sports,ADIDAS Black CC Oscillate M Sports Shoe
13657,Men,Footwear,Shoes,Sports Shoes,White,Fall,2011,Sports,ADIDAS White  Sports Shoe
13659,Men,Apparel,Topwear,Shirts,White,Fall,2011,Formal,Genesis Men Red Stripe Shirt
13661,Men,Apparel,Topwear,Shirts,White,Fall,2011,Formal,Genesis Men Thick Black Stripe Shirt
13662,Men,Apparel,Topwear,Shirts,White,Fall,2011,Formal,Genesis Men Blue Stripe Shirt
13666,Men,Apparel,Topwear,Shirts,Navy Blue,Fall,2011,Formal,Genesis Men Blue Solid Shirt
13668,Men,Apparel,Topwear,Shirts,Blue,Fall,2011,Formal,Genesis Men Blue Square Shirt
13669,Men,Apparel,Bottomwear,Trousers,Black,Fall,2011,Formal,Genesis Men Black Solid Trouser
13670,Unisex,Sporting Goods,Sports Equipment,Footballs,Gold,Fall,2011,Casual,Puma Unisex Liga XL Football
13671,Unisex,Apparel,Bottomwear,Jeans,Blue,Fall,2011,Casual,Levis Kids Blue Solid Jean
13672,Unisex,Apparel,Bottomwear,Jeans,Blue,Fall,2011,Casual,Levis Kids Blue Solid Jean
13673,Men,Footwear,Shoes,Casual Shoes,Black,Fall,2011,Casual,Puma Men Even Keel Casual Shoes
13674,Women,Footwear,Shoes,Casual Shoes,Black,Fall,2011,Casual,Puma Women Track Cat Basic Casual Shoes
13675,Men,Footwear,Shoes,Sports Shoes,Grey,Fall,2011,Sports,Puma Men TX-3 Running Shoes
13676,Men,Footwear,Shoes,Sports Shoes,Silver,Fall,2011,Sports,ADIDAS Men Titan Sports Shoes
13677,Men,Footwear,Shoes,Sports Shoes,White,Fall,2011,Sports,ADIDAS Men Running White Sports Shoes
13678,Women,Footwear,Shoes,Sports Shoes,Silver,Fall,2011,Sports,ADIDAS Women Blazer Sports Shoes
13679,Men,Footwear,Shoes,Sports Shoes,White,Spring,2013,Sports,ADIDAS Men Court Switch Sports Shoes
13680,Men,Footwear,Shoes,Sports Shoes,White,Fall,2011,Sports,ADIDAS Men Athlos Sports Shoes
13681,Women,Footwear,Shoes,Sports Shoes,Silver,Fall,2011,Sports,ADIDAS Women Furano 3 Sports Shoes
13682,Women,Footwear,Shoes,Sports Shoes,Silver,Fall,2011,Sports,ADIDAS Women Duramo 3 Sports Shoes
13683,Men,Footwear,Shoes,Sports Shoes,Blue,Fall,2011,Sports,ADIDAS Men Adi Quest Blue Sports Shoes
13684,Men,Footwear,Shoes,Casual Shoes,Black,Fall,2011,Casual,ADIDAS Men Dash Casual Shoes
13685,Men,Footwear,Shoes,Casual Shoes,Black,Fall,2011,Casual,ADIDAS Men Dash Casual Shoes
13686,Women,Footwear,Flip Flops,Flip Flops,Yellow,Fall,2011,Casual,ADIDAS Women Adi Sunshine Flip Flops
13687,Women,Footwear,Flip Flops,Flip Flops,Pink,Fall,2011,Casual,ADIDAS Women Adi Sunshine Flip Flops
13688,Unisex,Footwear,Shoes,Sports Shoes,Pink,Fall,2011,Sports,ADIDAS Kids Unisex Hyperrun 5K Sports Shoes
13689,Men,Footwear,Shoes,Sports Shoes,Black,Summer,2013,Sports,Reebok Men Premier Zigfly Sports Shoes
13690,Men,Footwear,Shoes,Sports Shoes,Black,Fall,2011,Sports,Reebok Men Zigdynamic Sports Shoes
13691,Men,Footwear,Shoes,Sports Shoes,White,Fall,2011,Sports,Reebok Men Premier Zigfly Sports Shoes
13696,Unisex,Accessories,Bags,Backpacks,Black,Fall,2011,Casual,Puma Unisex Silver Astar ride 3M Backpack
13697,Unisex,Accessories,Bags,Backpacks,Red,Fall,2011,Casual,Puma Unisex Black Backpack
13698,Unisex,Accessories,Bags,Backpacks,Navy Blue,Fall,2011,Casual,Puma Unisex White  Snova Sequence 4M Backpack
13699,Men,Footwear,Shoes,Sports Shoes,Blue,Fall,2011,Sports,ADIDAS Men CC Oscillate M Blue Sports Shoes
13700,Men,Footwear,Shoes,Sports Shoes,White,Spring,2013,Sports,ADIDAS Men Elite Speed White Sports Shoes
13701,Men,Footwear,Shoes,Sports Shoes,Black,Fall,2011,Sports,FILA Men Drik Black Sports Shoes
13702,Men,Footwear,Shoes,Sports Shoes,White,Fall,2011,Sports,FILA Men Dirk White Sports Shoes
13703,Men,Footwear,Shoes,Casual Shoes,Black,Fall,2011,Casual,Fila Men Black Gautier Shoes
13704,Women,Footwear,Shoes,Flats,Beige,Fall,2011,Casual,Clarks Women Prize Club Beige Wedges
13705,Men,Apparel,Topwear,Tshirts,Black,Fall,2011,Casual,Puma Men Mn's Body Train Black Tshirts
13706,Men,Apparel,Topwear,Waistcoat,Red,Fall,2011,Casual,Basics Men Red Checked Waistcoat
13707,Men,Apparel,Topwear,Tshirts,Red,Fall,2011,Casual,Proline Mens Solid Red Polo Tshirt
13711,Men,Apparel,Topwear,Tshirts,Black,Fall,2011,Casual,Proline Mens Solid Black Polo Tshirt
13712,Men,Apparel,Topwear,Tshirts,Black,Fall,2011,Casual,Proline Mens Solid Black Polo Tshirt
13713,Men,Apparel,Topwear,Tshirts,Grey,Summer,2013,Casual,Proline Men Grey Polo Tshirt
13714,Men,Apparel,Topwear,Sweaters,Black,Fall,2011,Casual,Proline Black Sleeveless Sweater
13715,Men,Apparel,Topwear,Tshirts,Black,Fall,2011,Casual,Proline Mens Solid Black Polo Tshirt
13717,Men,Accessories,Mufflers,Mufflers,White,Summer,2016,Casual,Proline White & Maroon Colourblocked Muffler
13718,Men,Accessories,Mufflers,Mufflers,Blue,Summer,2016,Casual,Proline Blue Patterned Muffler
13720,Men,Accessories,Mufflers,Mufflers,Maroon,Summer,2016,Casual,Proline Maroon Striped Muffler
13721,Men,Accessories,Headwear,Caps,Blue,Fall,2011,Casual,Proline Men Blue Patterned Beanie
13722,Men,Accessories,Headwear,Caps,Navy Blue,Fall,2011,Casual,Proline Men Navy & White Patterned Beanie
13724,Men,Accessories,Headwear,Caps,Black,Fall,2011,Casual,Proline Men Black Patterned Beanie
13725,Men,Accessories,Headwear,Caps,Maroon,Fall,2011,Casual,Proline Men Maroon & Black Patterned Beanie
13726,Women,Footwear,Shoes,Casual Shoes,Blue,Fall,2011,Casual,ADIDAS Women Blue Adi light casual Shoe
13727,Women,Footwear,Shoes,Sports Shoes,Silver,Fall,2011,Sports,ADIDAS Women Silver Adi Primo Sports Shoe
13728,Men,Apparel,Topwear,Shirts,Grey,Fall,2011,Formal,Belmonte Men Stripes Grey Shirts
13729,Men,Apparel,Topwear,Shirts,Pink,Fall,2011,Formal,Belmonte Men Stripes Pink Shirts
13730,Men,Apparel,Topwear,Shirts,Blue,Fall,2011,Formal,Belmonte Men Check Blue Shirts
13731,Men,Apparel,Topwear,Shirts,Purple,Fall,2011,Formal,Belmonte Men Solid Purple Shirts
13732,Men,Apparel,Topwear,Shirts,Red,Fall,2011,Casual,Belmonte Men Check Red Shirts
13733,Men,Apparel,Topwear,Shirts,Blue,Fall,2011,Formal,Belmonte Men Check Blue Shirts
13734,Men,Apparel,Topwear,Shirts,Blue,Fall,2011,Casual,Belmonte Men Check Blue Shirts
13735,Men,Apparel,Topwear,Shirts,Green,Fall,2011,Formal,Belmonte Men Stripes Green Shirts
13736,Men,Apparel,Topwear,Shirts,Red,Fall,2011,Casual,Belmonte Men Check Red Shirts
13737,Men,Apparel,Topwear,Shirts,Black,Fall,2011,Casual,Belmonte Men Check Black Shirts
13738,Men,Apparel,Topwear,Shirts,Green,Fall,2011,Casual,Belmonte Men Check Green Shirts
13739,Men,Apparel,Topwear,Shirts,Black,Fall,2011,Casual,Belmonte Men Check Black Shirts
13740,Men,Apparel,Topwear,Shirts,Grey,Fall,2011,Formal,Belmonte Men Check Grey Shirts
13741,Men,Apparel,Topwear,Shirts,Green,Fall,2011,Formal,Belmonte Men Check Green Shirts
